{
  "schemaVersion": 1,
  "document": {
    "title": "Minimal Valid Resume",
    "template": "classic",
    "maxPages": 1,
    "accent": "slate"
  },
  "profile": {
    "name": "Jane Doe",
    "links": []
  },
  "sectionOrder": [
    "summary",
    "experience",
    "education",
    "projects",
    "skills",
    "certifications"
  ],
  "experience": [],
  "education": [],
  "projects": [],
  "skills": [],
  "certifications": []
}
