{
  "schemaVersion": 1,
  "document": {
    "title": "Taylor Brooks — VP of Engineering (Two-Page)",
    "template": "classic",
    "maxPages": 2,
    "accent": "forest"
  },
  "profile": {
    "name": "Taylor Brooks",
    "headline": "Vice President of Engineering & Technology Executive",
    "email": "taylor.brooks@example.invalid",
    "phone": "+1-555-0177",
    "location": "New York, NY",
    "links": [
      {
        "id": "link-website",
        "label": "Executive Profile",
        "url": "https://example.com/taylorbrooks"
      },
      {
        "id": "link-linkedin",
        "label": "LinkedIn",
        "url": "https://example.com/linkedin-taylorbrooks"
      }
    ]
  },
  "summary": "Engineering executive with fifteen years of experience scaling high-performance engineering organizations, driving enterprise product velocity, and aligning technical roadmaps with business revenue targets. Built engineering departments from seed stage to post-IPO enterprise scale. Fictional sample resume.",
  "sectionOrder": [
    "summary",
    "experience",
    "education",
    "projects",
    "skills",
    "certifications"
  ],
  "experience": [
    {
      "id": "exp-vanguard",
      "employer": "Vanguard Commerce Cloud",
      "role": "Vice President of Engineering",
      "location": "New York, NY",
      "start": "2021-01",
      "current": true,
      "bullets": [
        "Led engineering organization of 140 software engineers, engineering managers, and directors across three global development hubs.",
        "Delivered next-generation B2B commerce platform driving $42M in net-new annual recurring enterprise software revenue.",
        "Instituted rigorous engineering metrics around DORA benchmarks, cutting lead time for changes from 2 weeks to 3 hours.",
        "Championed diversity, equity, and inclusion recruiting programs, achieving 42% underrepresented representation in senior management."
      ]
    },
    {
      "id": "exp-horizon",
      "employer": "Horizon Financial Software",
      "role": "Director of Engineering",
      "location": "New York, NY",
      "start": "2016-10",
      "end": "2020-12",
      "bullets": [
        "Managed four development departments totaling 55 engineers building high-frequency transaction settlement engines.",
        "Oversaw SOC 2 Type II and ISO 27001 regulatory compliance certifications across critical payment processing infrastructure.",
        "Restructured product delivery cadence into customer-aligned squads, boosting feature delivery consistency by 40%."
      ]
    },
    {
      "id": "exp-crest",
      "employer": "Crest Software Technologies",
      "role": "Engineering Manager",
      "location": "Jersey City, NJ",
      "start": "2012-05",
      "end": "2016-09",
      "bullets": [
        "Grew core backend payments team from 4 to 18 high-performing engineers while maintaining zero attrition over 24 months.",
        "Architected real-time fraud scoring pipeline evaluating 10,000 transactions per second with sub-50ms latency."
      ]
    }
  ],
  "education": [
    {
      "id": "edu-columbia",
      "institution": "Columbia Metropolitan University",
      "qualification": "M.S. in Technology Management",
      "location": "New York, NY",
      "start": "2010-09",
      "end": "2012-05",
      "details": [
        "Executive Leadership Fellowship in Strategic Innovation."
      ]
    },
    {
      "id": "edu-cornell",
      "institution": "Empire State University",
      "qualification": "B.S. in Computer Science & Applied Economics",
      "location": "Ithaca, NY",
      "start": "2006-09",
      "end": "2010-05",
      "details": [
        "Graduated Magna Cum Laude with honors."
      ]
    }
  ],
  "projects": [
    {
      "id": "proj-dora",
      "name": "DORA Metrics Executive Dashboard",
      "role": "Executive Sponsor",
      "url": "https://example.com/projects/dora-dashboard",
      "bullets": [
        "Commissioned and open-sourced automated engineering health framework connecting GitHub, Jira, and PagerDuty telemetry."
      ]
    }
  ],
  "skills": [
    {
      "id": "skills-leadership",
      "category": "Executive Leadership",
      "items": ["Organizational Design", "Executive Coaching", "Headcount Planning", "Budget Management ($20M+)", "Mergers & Acquisitions"]
    },
    {
      "id": "skills-strategy",
      "category": "Technical Strategy",
      "items": ["Enterprise Architecture", "Cloud Modernization", "Zero-Trust Security", "Disaster Recovery", "Vendor Negotiations"]
    },
    {
      "id": "skills-delivery",
      "category": "Operational Excellence",
      "items": ["DORA Metrics", "Agile at Scale", "SOC 2 Type II Compliance", "Continuous Delivery", "Incident Management"]
    }
  ],
  "certifications": [
    {
      "id": "cert-cism",
      "name": "Certified Information Security Manager (CISM)",
      "issuer": "ISACA",
      "date": "2021-11",
      "url": "https://example.com/cert/cism-sample"
    }
  ]
}
