{
  "schemaVersion": 1,
  "document": {
    "title": "Maximum Allowed String Boundaries Test Resume Document Title With Exact Character Bounds Validated",
    "template": "classic",
    "maxPages": 2,
    "accent": "navy"
  },
  "profile": {
    "name": "Alexandrina Bartholomew-Montgomery von Hohenzollern-Sigmaringen The Third Distinguishably Named",
    "headline": "Distinguished Principal Software Systems Engineering Fellow Leading Mission-Critical Fault-Tolerant Cloud Architectures",
    "email": "alexandrina.bartholomew-montgomery-distinguished-long-address@enterprise-consulting-domain.example.invalid",
    "phone": "+1-555-0199-extension-48201-direct",
    "location": "Greater Metropolitan Statistical Area of San Francisco and Silicon Valley Technopolis, California",
    "links": [
      {
        "id": "link-long",
        "label": "Comprehensive Verified Portfolio Index",
        "url": "https://example.com/very/deeply/nested/path/to/an/exceptionally/long/portfolio/resource/identifier/with/safe/parameters?query=verified&filter=none&session=abcdef1234567890abcdef1234567890abcdef1234567890abcdef1234567890"
      }
    ]
  },
  "summary": "Experienced software architect specializing in designing resilient distributed computing platforms, event-driven reactive microservices, and high-throughput transactional database infrastructures across geographically distributed cloud environments. Demonstrated track record in leading cross-functional engineering teams, authoring rigorous interface definitions, and reducing latency while upholding security standards.",
  "sectionOrder": [
    "summary",
    "experience",
    "education",
    "projects",
    "skills",
    "certifications"
  ],
  "experience": [
    {
      "id": "exp-enterprise",
      "employer": "Global Distributed Computing Infrastructure Corporation Worldwide Systems Division",
      "role": "Distinguished Enterprise Systems Architecture Principal Fellow and Engineering Director",
      "location": "San Francisco, CA and Remote",
      "start": "2020-01",
      "current": true,
      "bullets": [
        "Architected an ultra-high-throughput transactional message processing engine handling upwards of 45,000 distinct events per second across multi-region hybrid Kubernetes clusters with sub-millisecond p99 latency guarantees, complete deterministic audit logging, and automated fault recovery without data loss or service degradation during peak loads.",
        "Authored rigorous schema definition specifications, enforced automated drift detection in CI pipelines, and mentored fifty platform engineers on clean architecture patterns, defensive programming principles, and zero-trust security postures."
      ]
    }
  ],
  "education": [
    {
      "id": "edu-doctoral",
      "institution": "Polytechnic Institute of Advanced Distributed Computing Systems and Telecommunications",
      "qualification": "Doctor of Philosophy in Computer Science and Distributed Fault-Tolerant Algorithms",
      "location": "Cambridge, MA",
      "start": "2015-09",
      "end": "2019-12",
      "details": [
        "Doctoral Dissertation on Formal Verification of Consensus Protocols in Partially Synchronous Network Topologies with Byzantine Fault Resilience."
      ]
    }
  ],
  "projects": [],
  "skills": [
    {
      "id": "skills-specialized",
      "category": "Distributed Systems & Cloud Computing Architectures",
      "items": [
        "Distributed Consensus",
        "Formal Verification",
        "Deterministic State Machines",
        "Event Sourcing",
        "Performance Optimization"
      ]
    }
  ],
  "certifications": []
}
